{
  "schema_version": "run-projection.v1",
  "generated_at": "2026-07-14T14:00:00Z",
  "generated_by": "rw0-fixture",
  "source_machine": "nuc1",
  "run": {
    "run_id": "run_20260714T133000000005Z_00000000000000000000000000000005",
    "subject_type": "repository",
    "subject_id": "rw0-synthetic@0000000000000000000000000000000000000000",
    "project_id": "rw0-synthetic",
    "phase": "rw0-synthetic-completed-with-continuation",
    "machine": "NUC1",
    "model": "GPT/Codex synthetic",
    "actor": "synthetic-agent",
    "created_at": "2026-07-14T13:30:00Z",
    "completed_at": "2026-07-14T13:50:00Z",
    "duration_minutes": 20,
    "duration_source": "synthetic-fixture"
  },
  "state": {
    "execution": "COMPLETED",
    "evidence": "CAPTURED",
    "review": "PASS",
    "acceptance": "NO_DECISION",
    "owner_action": "OWNER_QA_PENDING",
    "notification": "NOT_SENT",
    "stage": "Synthetic technical validation complete; owner QA pending",
    "blocked": false,
    "warnings": [],
    "blockers": []
  },
  "flags": {
    "pushed": false,
    "deployed": false,
    "production_storage_active": false,
    "test_fixture_only": true,
    "production_acceptance_enabled": false
  },
  "validation": {
    "summary": "Synthetic checks: 2 passed, 0 failed, 2 total.",
    "checks": [
      {
        "id": "synthetic-continuation",
        "name": "Synthetic continuation fixture check",
        "status": "PASS",
        "passed": 2,
        "failed": 0,
        "total": 2,
        "source_artifact": "synthetic-continuation.txt"
      }
    ],
    "deep_validation": "NOT_IMPLEMENTED",
    "deep_validation_at": null
  },
  "evidence": {
    "summary": "Synthetic fixture evidence only; no production proof is referenced.",
    "status": "CAPTURED",
    "checked_at": "2026-07-14T13:51:00Z",
    "proof_dir": "/tmp/rw0-fixture-completed-with-continuation"
  },
  "artifacts": {
    "count": 1,
    "displayed_files": ["synthetic-continuation.txt"],
    "filter_explanation": "Only a synthetic fixture artifact name is displayed."
  },
  "acceptance": {
    "read_at": null,
    "acceptance_id": null,
    "scope": null,
    "limitations": ["Technical PASS is not owner acceptance; copied authorization is not transitive."],
    "superseded_by": null,
    "source": "not_production_active"
  },
  "links": {
    "report_url": null,
    "workspace_path": "/runs/run_20260714T133000000005Z_00000000000000000000000000000005"
  },
  "next_action": "Owner reviews the synthetic continuation shape; do not treat it as authorization.",
  "continuation": {
    "run_id": "run_20260714T133000000005Z_00000000000000000000000000000005",
    "project": "rw0-synthetic",
    "repository_path": "/tmp/rw0-fixture/repository",
    "accepted_commit": "0000000000000000000000000000000000000000",
    "machine": "NUC1",
    "current_stage": "Synthetic completed state with owner QA pending.",
    "proof_dir": "/tmp/rw0-fixture-completed-with-continuation",
    "report_url": null,
    "workspace_url": "https://habitat.slimyai.xyz/runs/run_20260714T133000000005Z_00000000000000000000000000000005",
    "what_passed": "Synthetic fixture contract checks passed.",
    "what_failed": "No synthetic fixture checks failed.",
    "blockers": [],
    "unresolved_questions": ["Owner review remains pending for this synthetic fixture."],
    "manual_qa_state": "pending_owner_review",
    "authority_status": "not_production_active",
    "push_authorized": false,
    "deploy_authorized": false,
    "restart_authorized": false,
    "prohibited_actions": [
      "Copied authorization is not transitive; obtain fresh live-owner authorization for any new action.",
      "Do not push, deploy, restart services, or activate production storage from this fixture."
    ],
    "next_bounded_mission": "Use this synthetic object only to test later fixture-mode continuation rendering.",
    "required_startup_files": [
      "AGENTS.md",
      "claude-progress.md",
      "feature_list.json",
      "PROJECT_NARRATIVE.md",
      "server-state.md",
      "init.sh"
    ],
    "required_validation": [
      "Confirm current machine matches continuation machine.",
      "Obtain fresh live-owner authorization before any hard-to-reverse action."
    ],
    "model_recommendation": "GPT/Codex synthetic",
    "writer_of_record": "Synthetic fixture only; no writer authority is conveyed.",
    "generated_at": "2026-07-14T14:00:00Z",
    "source_projection_digest": null,
    "handoff_complete": false
  },
  "integrity": {
    "source_refs": ["rw0-fixture:synthetic-only", "continuation-fixture:synthetic-only"],
    "digest": null
  }
}
